{
  "name": "m37-training-progress",
  "domain": "training-progress",
  "schemaVersion": 1,
  "schema": "m37-training-progress.schema.json",
  "cases": [
    {
      "name": "cuj1-checking-the-week",
      "function": "training_week",
      "note": "CUJ 1: Sunday evening. Lower and Run intervals done, an unplanned Wednesday, nothing on Thursday, a saved workout instead of Long run on Saturday.",
      "input": {
        "plans": [
          {
            "routineId": "r-hybrid",
            "entries": [{"workoutTemplateId": "t-lower", "weekday": 1}, {"workoutTemplateId": "t-run-intervals", "weekday": 2}, {"workoutTemplateId": "t-upper", "weekday": 4}, {"workoutTemplateId": "t-long-run", "weekday": 6}]
          }
        ],
        "workouts": [
          {"workoutId": "w-mon", "localDate": "2026-10-26", "startedAt": "2026-10-26T17:00:00.000Z", "endedAt": "2026-10-26T18:05:00.000Z", "focusId": "f-weights", "linkedTemplateId": "t-lower", "performedSetCount": 14},
          {"workoutId": "w-tue", "localDate": "2026-10-27", "startedAt": "2026-10-27T06:30:00.000Z", "endedAt": "2026-10-27T07:20:00.000Z", "focusId": "f-endurance", "linkedTemplateId": "t-run-intervals", "performedSetCount": 8},
          {"workoutId": "w-wed", "localDate": "2026-10-28", "startedAt": "2026-10-28T18:00:00.000Z", "endedAt": "2026-10-28T18:35:00.000Z", "focusId": "f-mobility", "linkedTemplateId": null, "performedSetCount": 6},
          {"workoutId": "w-sat", "localDate": "2026-10-31", "startedAt": "2026-10-31T08:00:00.000Z", "endedAt": "2026-10-31T09:10:00.000Z", "focusId": "f-endurance", "linkedTemplateId": "t-easy-spin", "performedSetCount": 1}
        ],
        "weekStart": "2026-10-26",
        "today": "2026-11-01"
      },
      "expected": {
        "weekStart": "2026-10-26",
        "comparedRoutineIds": ["r-hybrid"],
        "days": [
          {"localDate": "2026-10-26", "status": "done", "plannedCount": 1, "matchedCount": 1, "workoutCount": 1},
          {"localDate": "2026-10-27", "status": "done", "plannedCount": 1, "matchedCount": 1, "workoutCount": 1},
          {"localDate": "2026-10-28", "status": "trained", "plannedCount": 0, "matchedCount": 0, "workoutCount": 1},
          {"localDate": "2026-10-29", "status": "not_done", "plannedCount": 1, "matchedCount": 0, "workoutCount": 0},
          {"localDate": "2026-10-30", "status": "rest", "plannedCount": 0, "matchedCount": 0, "workoutCount": 0},
          {"localDate": "2026-10-31", "status": "done_differently", "plannedCount": 1, "matchedCount": 0, "workoutCount": 1},
          {"localDate": "2026-11-01", "status": "rest", "plannedCount": 0, "matchedCount": 0, "workoutCount": 0}
        ]
      }
    },
    {
      "name": "cuj2-today-pending",
      "function": "training_week",
      "note": "The Data shapes example: CUJ 2 reduced to the Thursday plan. An unplanned morning run leaves today Pending.",
      "input": {
        "plans": [{"routineId": "r1", "entries": [{"workoutTemplateId": "t-upper", "weekday": 4}]}],
        "workouts": [{"workoutId": "w1", "localDate": "2026-10-29", "startedAt": "2026-10-29T06:00:00.000Z", "endedAt": "2026-10-29T06:45:00.000Z", "focusId": "f-e", "linkedTemplateId": null, "performedSetCount": 1}],
        "weekStart": "2026-10-26",
        "today": "2026-10-29"
      },
      "expected": {
        "weekStart": "2026-10-26",
        "comparedRoutineIds": ["r1"],
        "days": [
          {"localDate": "2026-10-26", "status": "rest", "plannedCount": 0, "matchedCount": 0, "workoutCount": 0},
          {"localDate": "2026-10-27", "status": "rest", "plannedCount": 0, "matchedCount": 0, "workoutCount": 0},
          {"localDate": "2026-10-28", "status": "rest", "plannedCount": 0, "matchedCount": 0, "workoutCount": 0},
          {"localDate": "2026-10-29", "status": "pending", "plannedCount": 1, "matchedCount": 0, "workoutCount": 1},
          {"localDate": "2026-10-30", "status": "rest", "plannedCount": 0, "matchedCount": 0, "workoutCount": 0},
          {"localDate": "2026-10-31", "status": "rest", "plannedCount": 0, "matchedCount": 0, "workoutCount": 0},
          {"localDate": "2026-11-01", "status": "rest", "plannedCount": 0, "matchedCount": 0, "workoutCount": 0}
        ]
      }
    },
    {
      "name": "cuj2-today-is-not-over",
      "function": "training_week",
      "note": "CUJ 2 with the whole Hybrid block: Thursday morning, an unplanned run. Thursday is Pending, Saturday is Planned.",
      "input": {
        "plans": [
          {
            "routineId": "r-hybrid",
            "entries": [{"workoutTemplateId": "t-lower", "weekday": 1}, {"workoutTemplateId": "t-run-intervals", "weekday": 2}, {"workoutTemplateId": "t-upper", "weekday": 4}, {"workoutTemplateId": "t-long-run", "weekday": 6}]
          }
        ],
        "workouts": [
          {"workoutId": "w-mon", "localDate": "2026-10-26", "startedAt": "2026-10-26T17:00:00.000Z", "endedAt": "2026-10-26T18:00:00.000Z", "focusId": "f-weights", "linkedTemplateId": "t-lower", "performedSetCount": 12},
          {"workoutId": "w-tue", "localDate": "2026-10-27", "startedAt": "2026-10-27T06:30:00.000Z", "endedAt": "2026-10-27T07:15:00.000Z", "focusId": "f-endurance", "linkedTemplateId": "t-run-intervals", "performedSetCount": 6},
          {"workoutId": "w-thu-run", "localDate": "2026-10-29", "startedAt": "2026-10-29T06:00:00.000Z", "endedAt": "2026-10-29T06:40:00.000Z", "focusId": "f-endurance", "linkedTemplateId": null, "performedSetCount": 1}
        ],
        "weekStart": "2026-10-26",
        "today": "2026-10-29"
      },
      "expected": {
        "weekStart": "2026-10-26",
        "comparedRoutineIds": ["r-hybrid"],
        "days": [
          {"localDate": "2026-10-26", "status": "done", "plannedCount": 1, "matchedCount": 1, "workoutCount": 1},
          {"localDate": "2026-10-27", "status": "done", "plannedCount": 1, "matchedCount": 1, "workoutCount": 1},
          {"localDate": "2026-10-28", "status": "rest", "plannedCount": 0, "matchedCount": 0, "workoutCount": 0},
          {"localDate": "2026-10-29", "status": "pending", "plannedCount": 1, "matchedCount": 0, "workoutCount": 1},
          {"localDate": "2026-10-30", "status": "rest", "plannedCount": 0, "matchedCount": 0, "workoutCount": 0},
          {"localDate": "2026-10-31", "status": "planned", "plannedCount": 1, "matchedCount": 0, "workoutCount": 0},
          {"localDate": "2026-11-01", "status": "rest", "plannedCount": 0, "matchedCount": 0, "workoutCount": 0}
        ]
      }
    },
    {
      "name": "cuj2-upper-done-in-the-evening",
      "function": "training_week",
      "note": "CUJ 2, later: a Set completed in a Workout started from Upper makes Thursday Done, whatever else was logged that day.",
      "input": {
        "plans": [
          {
            "routineId": "r-hybrid",
            "entries": [{"workoutTemplateId": "t-lower", "weekday": 1}, {"workoutTemplateId": "t-run-intervals", "weekday": 2}, {"workoutTemplateId": "t-upper", "weekday": 4}, {"workoutTemplateId": "t-long-run", "weekday": 6}]
          }
        ],
        "workouts": [
          {"workoutId": "w-mon", "localDate": "2026-10-26", "startedAt": "2026-10-26T17:00:00.000Z", "endedAt": "2026-10-26T18:00:00.000Z", "focusId": "f-weights", "linkedTemplateId": "t-lower", "performedSetCount": 12},
          {"workoutId": "w-tue", "localDate": "2026-10-27", "startedAt": "2026-10-27T06:30:00.000Z", "endedAt": "2026-10-27T07:15:00.000Z", "focusId": "f-endurance", "linkedTemplateId": "t-run-intervals", "performedSetCount": 6},
          {"workoutId": "w-thu-run", "localDate": "2026-10-29", "startedAt": "2026-10-29T06:00:00.000Z", "endedAt": "2026-10-29T06:40:00.000Z", "focusId": "f-endurance", "linkedTemplateId": null, "performedSetCount": 1},
          {"workoutId": "w-thu-upper", "localDate": "2026-10-29", "startedAt": "2026-10-29T18:00:00.000Z", "endedAt": "2026-10-29T19:00:00.000Z", "focusId": "f-weights", "linkedTemplateId": "t-upper", "performedSetCount": 1}
        ],
        "weekStart": "2026-10-26",
        "today": "2026-10-29"
      },
      "expected": {
        "weekStart": "2026-10-26",
        "comparedRoutineIds": ["r-hybrid"],
        "days": [
          {"localDate": "2026-10-26", "status": "done", "plannedCount": 1, "matchedCount": 1, "workoutCount": 1},
          {"localDate": "2026-10-27", "status": "done", "plannedCount": 1, "matchedCount": 1, "workoutCount": 1},
          {"localDate": "2026-10-28", "status": "rest", "plannedCount": 0, "matchedCount": 0, "workoutCount": 0},
          {"localDate": "2026-10-29", "status": "done", "plannedCount": 1, "matchedCount": 1, "workoutCount": 2},
          {"localDate": "2026-10-30", "status": "rest", "plannedCount": 0, "matchedCount": 0, "workoutCount": 0},
          {"localDate": "2026-10-31", "status": "planned", "plannedCount": 1, "matchedCount": 0, "workoutCount": 0},
          {"localDate": "2026-11-01", "status": "rest", "plannedCount": 0, "matchedCount": 0, "workoutCount": 0}
        ]
      }
    },
    {
      "name": "cuj3-rotating-routine-only",
      "function": "training_week",
      "note": "CUJ 3: a rotating Cadence plans no date, so the loaders pass no plan. Days with a Logged Workout are Trained, every other day No plan, nothing Not done.",
      "input": {
        "plans": [],
        "workouts": [
          {"workoutId": "w-mon", "localDate": "2026-10-26", "startedAt": "2026-10-26T17:00:00.000Z", "endedAt": "2026-10-26T18:00:00.000Z", "focusId": "f-weights", "linkedTemplateId": "t-day-1", "performedSetCount": 10},
          {"workoutId": "w-wed", "localDate": "2026-10-28", "startedAt": "2026-10-28T17:00:00.000Z", "endedAt": "2026-10-28T18:00:00.000Z", "focusId": "f-weights", "linkedTemplateId": "t-day-2", "performedSetCount": 10}
        ],
        "weekStart": "2026-10-26",
        "today": "2026-10-29"
      },
      "expected": {
        "weekStart": "2026-10-26",
        "comparedRoutineIds": [],
        "days": [